id,question,A,B,C,D,Answer,Explanation,Hint
1,Which of the following is the most liquid of a bank's assets?,short-term business loans,securities,long-term business loans,cash,A,"A.	Short-term business loans.
It refers to money given to businesses that is meant to be repaid within a short duration of less than a year. They have higher interest rates compared to short-term loans.
B.	Securities.
Securities refer to financial instruments that are negotiable and fungible that have a monetary value. They usually are tradable financial assets such as equities or fixed income instruments bought as an investment.
Securities are classified into equities and debts.
C.	Long-term business loans.
It refers to money given to businesses. The money is payable within a longer duration of time than short-term loans. The repayment duration can range from one year and above. They have lower interest rates in comparison to short-term loans.
D.	Cash.
Cash, in this case, refers to monies deposited to the bank by different individuals and businesses. The cash deposit is cashable into a personal bank account or a savings account.
Therefore, based on the above definitions and considering what a liquid asset is, the most liquid asset for a bank is its cash.",Liquidity.: Liquidity refers to the degree in which an asset can be quickly brought or sold to the market at a price that replicates its fundamental value. It equally refers to the ease with which an asset or security is converted into cash without interfering with its market price.
2,The first step in managing cash more effectively is:,having an adequate cash reserve for emergency expenditures,rapid payment of accounts payable,speeding up payment of accounts receivable,understanding the company's cash flow cycle,D,"The correct answer is
D) understanding the company's cash flow cycle.
The cash flow cycle explains where a company's money goes. It is organized by activities that bring cash in (cash inflows) and activities that send cash out (cash outflows).
Other options are incorrect because
Having an adequate cash reserve for emergency expenditures can only happen once a company has established where its money goes in the first place.
Payment of accounts payable happens towards the end of the cash flow cycle and clears all obligations/debts.
Speeding up payment of accounts receivable will ultimately increase available cash, but it is not guaranteed.","Cash Management Cash management is a company's ability to control its cash assets. Cash is considered the most liquid asset and is therefore easily spent without a management system in place. Due to its accessibility and ease of use, cash must be controlled and managed to ensure that the firm has capital for current expenses."
3,Financial intermediaries provide customers with liquidity services. Liquidity services?,make it easier for customers to conduct transactions.,allow customers to have a cup of coffee while waiting in the lobby.,are a result of the asymmetric information problem.,are another term for asset transformation.,A,"The correct answer is Option A
The liquidity services are provided by the financial intermediaries to their customers to convert their money into assets and vice versa, i.e., assets back into money based on professional advice. Also, the credit facilities provided by the financial intermediaries to facilitate the expansion of business.
The explanation of incorrect options are:
B)
The service provided to the customer to have a cup of coffee is a hospitality service provided by the hotel.
C)
The asymmetric information problem where either the borrower or the lender is vigilant and aware of the market's situation. This is mainly caused due to the curiosity of the informed party.
D)
Asset transformation is converting long-term and short-term assets into money. The converted money can be either be given as a loan or invest in some other asset as per the personal choice of the investor.",Financial Intermediaries: Financial Intermediaries like banks accept deposits in the form of investments from the investors and provide loans to the borrowers. It earns revenue by way of differential interest receipts and payments.
4,Credit cards that allow consumers to borrow up to a specified maximum amount are examples of __________.,installment credit,collateral-based credit,revolving open-end credit,non-installment credit,C,"Credit cards that allow consumers to borrow up to a specified maximum amount are examples of
C. revolving open-end credit
Revolving open-end credit is based on income and credit history. In this credit, interest will be charged each month on the remaining balance. It is the extended line of credit established in advance such as a credit card. Revolving credit has the flexibility to provide the companies to borrow and use the funds.","Credit: Credit is a promise based on a belief that debtors or borrowers will pay on demand or at some future time. The creditor exchange present goods for the right to receive payments in the future. There are three types of credit, namely installment, non-installment, and revolving open-end credit."
5,Explain the relationship between liquidity management from the financial day to day operation of :,educational institution,hospital,short-term projects of an organization,,A,"a. Liquidity management is required in educational institutions daily. It can be daily expenses like maintenance of the facilities like library, sanitation, water facilities, transportation facilities.
b. Liquidity management is required in hospitals daily. It can be daily expenses like arranging the blood groups from outside, maintain the quality of services, cleaning services requirements.
c. Liquidity management is required in short-term projects of an organization daily. It can be daily expenses like purchasing raw material, maintain the working environment by providing drinking water, sanitation facilities.",Liquidity management Liquidity management depicts converting the asset into cash at less time period. The cash helps different facilities and services to run smoothly.
6,Which of the following are not considered money market securities?,Treasury bills,Mortgage-backed securities,negotiable certificates of deposit,commercial paper,B,"The answer is
b. Mortgage-backed securities.
Marketable securities have maturity term of 1 year and less while the mortgage-back securities (MBSs) are treated as bonds with a long-term maturity. Hence, MBSs should not be classified as marketable securities.","Firm's Liquidity: Firm's liquidity is an important aspect that managers should pay more attention to control it efficiently. In practice, a business will maintain cash, cash equivalents, marketable securities and other liquid assets to support the liquidity."
7,Which of the following listed below is not a motive to save?,life cycle,independence motive,liquidity,down payment,C,"Correct answer:
Option c) Liquidity.
Explanation:
The objective of savings is not liquidity as liquidity indicates readily available cash and when the cash is readily available people tend to spend it and that is why they make savings in fixed deposits, recurring deposits so that they do not find liquid cash.
An independence motive represents the motive to save in order to enjoy a sense of independence and the power to do things not knowing as to what to do.
A downpayment motive represents the motive to save for buying houses, cars, etc.
A life cycle motive represents the motive to save for future relationships between the individual and his needs.
Hence option c) is correct.","Savings: Savings are important for every individual at present in order to be prepared for the contingencies on the way and savings also help in rotation of money which impacts the economy in a healthy way. There are various motives behind why people save income. A few of the motives include the precautionary motive, the intertemporal substitutional motive, the bequest motive, etc."
8,Which of the following assets is the most liquid?,stocks,currency,checkable bank deposits,money market mutual funds,B,"The correct option is
b. Currency
.
Liquid assets are those assets that can be easily converted into cash.  Also, a currency itself can be used as cash for buying and selling purposes.",Commercial Banks: Commercial banks can be stated as the financial institutions that keep the surplus money of the individuals as deposits with themselves and lend that money to individuals who need it to gain profit.
9,"If households convert some of their bank deposits into currency, then, other things equal, which of the following will occur?",commercial banks' reserves decline and the monetary base is unchanged,commercial banks' reserves decline and the monetary base declines,commercial banks' reserves rise and the monetary base rises,commercial banks' reserves are unchanged and the monetary base is unchanged,A,"The correct option is: a. commercial banks' reserves decline and the monetary base is unchanged.
Explanation:
If households convert some of their bank deposits into currency, then it would lead to a reduction in bank reserves as the bank will have fewer assets to lend out loans. Even though the commercial bank reserves decline, there will be no reduction in the monetary base, and it remains unchanged as the currency is still circulating in the economy. The monetary base consists of both chequable deposits and cash in hand.
Reason for other options:
Option b) is incorrect because there will be no reduction in the monetary base.
Option c) is incorrect because there will be no increase in the monetary base or commercial bank reserves.
Option d) is incorrect because there will be a reduction in commercial bank reserves.","Liquidity: Liquidity describes the flow of currency in an economy. It can be controlled by various monetary policy tools. Furthermore, the amount of liquidity determines the amount of economic activity taking place in the economy."
10,Cash management involves the determination of:,the minimal size of a firm's asset balance,the maximum amount of dividends that should be paid,the optimal size of a firm's liquid asset balance,the range of long-term financial alternatives,C,"The answer is
c. The  optimal size of a firm's liquid asset balance.
Cash management will direct firm's managers in structuring propositions of firm's assets, which will achieve profits and liquidity simultaneously. Alternatively, cash management support managers in allocating monetary resources in both long-term assets for future earnings and short-term assets for securing regular demand for cash. With that being said, the determination of the size of liquid asset balance will be executed by the cash management.","Cash Management: Cash management is a necessary process in a business, in which managers will arrange cash receipts and cash disbursements to ensure sufficient funds for the operation. Note that, the lack of money will incur the shortage costs and affect the firm's business performance."
11,Which of the following is/are the most liquid of a company's assets?,I only,II only,Both I and II,Neither I nor II,B,"The answer is
b. Only II.
Both account receivables and inventory are current assets. However, account receivables is considered to be more liquid compared to inventory. If the quality of inventory is substandard, it is not possible to convert inventory in cash quickly.","Current Asset: Current assets refer to short-term assets that will be held for one year and less. Current assets happen to ensure that daily operational activities will be running efficiently. In addition, current assets will also indicate the health of firm's liquidity."
12,Which of the following is not a basic principle of cash management?,Increase the speed of collection on receivables.,Maintain idle cash.,Keep inventory levels low.,Delay payment of liabilities.,B,"The correct answer is option B. Maintain idle cash.
Maintaining idle cash is not a fundamental principle of cash management. Efficient cash management aims to optimize the use of cash resources, reduce idle cash, and invest any excess cash in short-term, liquid investments to generate returns while ensuring enough cash is available to meet operating needs and obligations. The other options (A, C, and D) are consistent with effective cash management practices.","Cash Flow: Cash flows in accounting refer to the movement of money in and out of a business. They are crucial for financial stability, indicating inflows and outflows necessary for operations, debt payments, and growth investments."
13,"With respect to the interest rate,",what is the liquidity effect?,what is the price-level effect?,what is the expectations effect?,,C,"Concerning interest rate, the liquidity effect is the degree to which an asset can be sold fast in the market at a price that reflects its intrinsic worth. Cash is the most liquid asset as it can be easily converted to other assets like real estate, financial assets, etc. A liquid asset will have low interest rates as its sale is fast or not risky, while a non-liquid asset will have high-interest rates due to its riskiness.
Price level effect refers to the average price assigned to a product, security, or service in the economy. Low price levels boost autonomous spending as people make more purchases, leading to low-interest rates and vice versa.
Expectations affect refer to how expectations or anticipations influence people's behaviors and perceptions. When a person anticipates getting money in the future, his/her spending will be high, translating to high-interest rates since he will borrow more and vice versa.","Interest Rate: Interest rate is the amount a lender charges the borrower for using his/her assets and is expressed as the principal's percentage. It is noted annually, referred to as the annual percentage rate (APR). Assets can be cars, consumer products, buildings, vehicles, etc. Simple interest rates and compound interest rates are the two common types with mortgages using simple rates while other loan types use compound interest rates. High-risk loans have high interest rates and vice versa."
14,Americans generally spend over _____ of their income on consumption.,one-third,one-half,two-thirds,nine-tenths,D,"Answer: D
The personal savings rate in the US has usually been around 7-8% before the lockdown crisis. It has since risen to 20-30% but this is a temporary phenomenon. Thus the answer is D. Sources for this can be found here on Fred:  https://fred.stlouisfed.org/series/PSAVERT","Personal Savings: American's are notorious for living beyond their means. Although wages in the US are among the highest in the world, many Americans still finance consumption using debt. This is only possible because of America's unique position of a reserve currency and a net importer."
15,"If the price of gold becomes less volatile, then, other things equal, the demand for stocks will __________ and the demand for antiques will __________.",increase; increase,increase; decrease,decrease; decrease,decrease; increase,C,"The correct answer is C). Decrease, Decrease
Explanation:
If the price of gold rises, there is a situation of less gold volatility. This will eventually reduce the demand for all expensive and antique goods, resulting in a decrease for other gold equal stocks and Antiques.
The explanation for the other answer is as follows:
Option A): When there is more volatility for gold, then only there would be an increase in the demand for antiques and other gold equal stock.
Option B):  The less volatility will lead to a decrease in the market for gold similar stocks, so it is incorrect.
Option D): The Change in gold rate, such as increasing gold rate, will negatively affect the demand for antiques.","Liquid Asset The asset is the resources that possess the quality of cash equivalent; when the asset is quickly converted to cash, such asset is termed a liquid asset. The gold maintains the highest liquidity among assets followed by silver etc."
16,The optimal amount of the firm's liquid asset balance to be invested in marketable securities is a function of:,the interest earned over the expected holding period,the transaction cost involved in buying and selling the securities,the spread between long-term and short-term interest rates,the interest earned over the expected holding period and the transaction cost involved in buying and selling the securities,D,"The answer is
d. the interest earned over the expected holding period and the transaction cost involved in buying and selling the securities
For marketable securities, the management should concern both expected interest and the capital losses by selling them as well. The interest earned will be cash inflows while capital losses are cash outflows. The optimal amount of the firm's liquid asset balance should consider those two cash flows.",Marketable Securities: Marketable securities could be either equity or bond securities. A firm would purchase those securities to maintain firm's liquidity since those securities are able to convert to cash quickly.
17,Liquid asset balances include all of the following except:,accounts receivable,checking account balances,marketable securities,currency on hand,A,"The answer is
a. Accounting receivable.
Even though account receivable is a portion of current assets, it is excluded from the balance of liquid assets. The balance of liquid assets will consist of short-term assets that can be converted in cash immediately such as bank deposits, cash equivalents, holding currencies and marketable securities.","Liquid Assets: Liquid assets are short-term assets that can be converted into cash quickly. With that being said, a firm will hold a proposition of assets as liquid assets to secure the firm's liquidity. Note that, liquid assets would produce lower return compared to other long-term assets."
18,Which statement would best provide information about a company's current liquidity?,Balance sheet.,Income statement.,Statement of cash flows.,None of the above.,A,"The answer is
a. Balance sheet.
a. Correct. The firm's liquidity is evaluated through the relationship between the firm's current assets and current liabilities, which are reported in the balance sheet.
b. Incorrect. The income statement reports the firm's revenues, expenses and income during the year. Liquidity can not be evaluated through an income statement.
c. Incorrect. The statement of cash flows consists of historical cash receipts and cash disbursements incurred during the year.","Liquidity: Within a firm, liquidity refers to the ability to cover its upcoming obligations. Strong liquidity ensures a business maintains its normal operational activities. Thus, managers should review the firm's liquidity regularly to secure an efficient operation."
19,Mutual fund managers seek securities that are very liquid so that they can easily sell them in the secondary market at any time.,True,False,,,A,"The answer is
a. True.
While some mutual fund managers have more of a long-term strategy with their assets, if two securities have an equal risk and expected return, then the manager will select the more liquid of the two securities in order to maximize their flexibility.",What Is Liquidity: Different types of securities have different levels of Liquidity. Liquidity specifically refers to the ability to quickly buy and sell units of these securities and is generally a function of how big the marketplace is for these securities. Greater Liquidity will give the most up-to-date market prices.
21,"By international standards, the household saving rate of the United States _____ which may be due to the fact that _____.",has historically not been very high; government assistance to the elderly has reduced the need for life-cycling saving,"has historically been very high; most Americans already own homes and, therefore, have less need for life-cycle saving","has historically not been very high; most Americans already own homes and, therefore, have less need for life-cycle saving",has historically been high government assistance to the elderly has reduced the need for life-cycling saving,C,"The correct answer is option C) has historically not been very high; most Americans already own homes and, therefore, have less need for life-cycle saving
It is observed that in the United States the people are rich and educated too so they can easily get the work anywhere and fulfill the needs and found that the United States peoples dont focus too much on the saving that's why the data of the United States shows that the saving of the people is very low because the people of the United States already have their homes, therefore, dont focus on saving too much,","Human needs: Human is only live the life for their stomach and to fulfill their basic needs, and for this, the human does the work in different places to earn money because money is only the thing that can fulfill the basic needs of humans and the humans always feel happy after this."
22,Which of the following actions would improve a firm's liquidity?,selling bonds and increasing cash,increasing the company's dividend payments,repurchasing stock,buying bonds,D,"The liquidity of a firm will improve if it has more availability of cash that can be deployed to various operational requirements without delay. Among the given options, only the decision of selling bonds will lead to an improvement in liquidity due to the proceeds received.
Other three options of increasing dividend payments, repurchasing stock, and buying bonds will lead to cash outflow thereby reducing the liquidity.",Liquidity: The liquidity for a firm or individual represents the ability of an asset to get converted into cash without time lag and without a reduction in value. Liquidity ratios can be used to compare the financial liquidity of various firms.
23,A(n) _____ asset can be quickly converted into cash without significant loss in value.,current,fixed,intangible liquid,,A,"A
a. current
asset can be quickly converted into cash without significant loss in value.
Fixed assets are long and they use value over time. They are still more liquid than intangible ones. On the other hand, option a. can be converted into cash within a year and the loss of value, if any, is insignificant.","Assets: By nature, these holdings are classified as fixed assets and current assets. By tangibility, they are classified into tangible and intangible assets. Intangible assets are less commonly found in firms. Bigger companies tend to own more intangible assets as they have the efficiency, time, and money to spend for patents, copyrights, trademarks, etc."
24,The cash management function is concerned with determining:,the optimal size of a firm's liquid asset balance,the appropriate types and amounts of short-term investments the firm should make,the most efficient methods of controlling the collection and disbursement of cash,all of these answers are correct.,D,"The answer is
d. all of these answers are correct.
The cash management aims to solve the potential shortage of funds for maintaining regular business activities. Managers will have to determine the proposition of liquid assets to the total firm's assets. Alternatively, an improvement in the payment collection system will be required, which helps to predict cash receipts and cash disbursements in the future. With that being said, managers can arrange the firm's monetary resources efficiently.",Liquidity: Liquidity is one of the most important aspects of a firm that requires regular reviews from the management team. The liquidity management aims to avoid potential costs when the firm cannot supply sufficient funds to encourage efficient operation.
25,Saving equals,income minus consumption expenditure minus net taxes,income minus net taxes,total income minus total expenditure,net taxes minus government expenditure,A,"The answer is A. Saving equals income minus consumption expenditure minus net taxes. Customarily, individuals save after obtaining the fundamental goods and services, just like in the investment case. Therefore, upon monthly payment of the income, taxes are usually paid depending on the income received tax rates. Afterward, consumers purchase what they need for subsistence survival and can choose to either save or invest. Thus, saving is equal to investment since they follow a similar concept.","Economy: An economy is defined as the state of an area in terms of production, consumption, and distribution of products and services. An economy is a fundamental determinant in the allocation of scarce resources in society. Upon allocation, these resources are translated into goods and services with a utility that satisfies people's unlimited wants. As a result, they end up benefiting the people living or operating in that area. Moreover, most countries use the economy as a measure of progress by measuring the real GDP, which is an economic indicator to access the economy's performance."
26,"The ""liquidity"" of an asset refers to",how well the asset serves as a store of value.,the rate of return earned by the holder of the asset.,the ease with which the asset may be converted into a medium of exchange without loss of value.,how well the asset serves as a hedge against inflation.,C,"The answer is C. the ease with which an asset may be converted into a medium of exchange without loss of value.
.
A firm's liquidity is the amount of assets that can be quickly converted to cash to pay off short term debt obligations.  The current ratio is a good measure of liquidity.  Divide the current assets by the current liabilities, where the term current is around a year.  A recommended current ratio is 2 to 1.  It gives the company room to pay its short term obligations.",Quick Ratio The quick ratio is a financial ratio that divides the current assists minus inventories by current liabilities to determine a firm's ability to survive a short term issue with cash flow.
