id,question,A,B,C,D,Answer,Explanation,Hint
27,The best way to get the most from your money is through careful evaluation of your alternatives.,True,False,,,A,"True, one has to evaluate all the alternative choices available in order to make a good decision. In matters of money, one has to decide and choose between various investment options that will yield maximum returns.
To effectively evaluate these alternatives, one has to draw a financial roadmap to access their financial situation and goals.
Secondly, one should consider their risk tolerance levels since each alternative has a certain degree of risk.
Thirdly, the individual should gather information about all the alternatives and evaluate the alternatives based on information gathered. This process will enable the individual to make the right choice thus maximizing their returns on the money invested.","Money: Money is a method of payment for goods and services, repayment of debts, and taxes, that is generally accepted in a particular country. It is used in various ways; as a means of exchange, to store wealth, to make deferred payments among others. Economies rely on the exchange of money for a product of products and services."
28,"If the price of gold becomes less volatile, then, other things equal, the demand for stocks will __________ and the demand for antiques will __________.",increase; increase,increase; decrease,decrease; decrease,decrease; increase,C,"The correct answer is C). Decrease, Decrease
Explanation:
If the price of gold rises, there is a situation of less gold volatility. This will eventually reduce the demand for all expensive and antique goods, resulting in a decrease for other gold equal stocks and Antiques.
The explanation for the other answer is as follows:
Option A): When there is more volatility for gold, then only there would be an increase in the demand for antiques and other gold equal stock.
Option B):  The less volatility will lead to a decrease in the market for gold similar stocks, so it is incorrect.
Option D): The Change in gold rate, such as increasing gold rate, will negatively affect the demand for antiques.","Liquid Asset The asset is the resources that possess the quality of cash equivalent; when the asset is quickly converted to cash, such asset is termed a liquid asset. The gold maintains the highest liquidity among assets followed by silver etc."
29,All of the following are cash management strategies to expedite collections except:,a lockbox collection system,wire transfers,decentralized collection system,the use of drafts instead of checks,D,"The answer is
d. The use of drafts instead of checks
A bank draft would be safer than a regular check since the amount of money on check is guaranteed by the bank. However, to write a bank draft, a customer should have the required amount of money available in bank account, in which that amount will be frozen by the bank. With that being said, the payment will be delayed until the customer has sufficient funds for the draft.",Cash Management: Cash management is an essential process in a business. This process will help the firm to sustain its ability to run operational activities efficiently with the minimal shortage costs. The lack of this process might cause a business to engage a serious problem of financial insolvency.
30,The first step in managing cash more effectively is:,having an adequate cash reserve for emergency expenditures,rapid payment of accounts payable,speeding up payment of accounts receivable,understanding the company's cash flow cycle,D,"The correct answer is
D) understanding the company's cash flow cycle.
The cash flow cycle explains where a company's money goes. It is organized by activities that bring cash in (cash inflows) and activities that send cash out (cash outflows).
Other options are incorrect because
Having an adequate cash reserve for emergency expenditures can only happen once a company has established where its money goes in the first place.
Payment of accounts payable happens towards the end of the cash flow cycle and clears all obligations/debts.
Speeding up payment of accounts receivable will ultimately increase available cash, but it is not guaranteed.","Cash Management Cash management is a company's ability to control its cash assets. Cash is considered the most liquid asset and is therefore easily spent without a management system in place. Due to its accessibility and ease of use, cash must be controlled and managed to ensure that the firm has capital for current expenses."
31,An asset's liquidity measures its:,potential for generating a profit.,cash requirements.,ease and cost of being converted to cash.,proportion of debt financing.,C,"The correct answer to the given question is option
C. ease and cost of being converted to cash.
The liquidity of an asset is usually measured by using following parameters:
1) Ability of the asset to get converted into cash
2) Quickness with which the asset gets converted into cash
3) No or low reduction in the value of asset when converted into cash","Liquidity Management: In the parlance of finance, the liquidity is one of the financial characteristics of any financial asset or instrument. There are even a few liquidity financial ratios which are used to measure the liquidity of a firm. These ratios are current ratio, quick or acid-test ratio and cash ratio."
32,Which of the following is an outflow of cash?,Profitable operations,The sale of equipment,The sale of the company's common stock,The payment of cash dividends,D,"The correct option is
Option D: The payment of cash dividends
.
Option A: Profitable operations describe the net profit remaining with the entity after deducting costs from revenues. It excludes tax and interest payments. Therefore, this is stated as a cash inflow and an inaccurate option.
Option B: Selling any equipment by the individual or entity brings cash into the organization. The funds are not going out of the entity here. Thus, this option is also inaccurate.
Option C: When company stocks are sold, such a task is to raise funds for the entity. Issuing shares bring money into the organization and is not a cash outlay. This option is also inaccurate.
Option D: Paying a cash dividend is regarded as a cash outflow and reported as a financing activity. The entry passed for such is a debit to the dividend payable account and a credit to the cash account. It is a liability for the entity when it is paying out. Thus, this option is accurate.","Cash Management: Cash management specifies the practices for handling and gathering cash flows resulting from financing, investing, and operational activities. This practice is also known as ""treasury management."""
33,Which of the following bank assets is the most liquid?,Consumer loans,Reserves,Cash items in process of collection,U.S. government securities,B,"The correct answer is
B) Reserves
A bank holds cash, which is called reserves. If consumers become worried that the bank does not have adequate money and want to withdraw cash from their bank accounts, the bank would have to tap into its reserves. It is the most liquid bank asset that can be quickly converted to cash.
The second most liquid bank asset is cash items in the process of collection. These are items such as checks that have not cleared the bank yet. Next are U.S. government securities. These can be resold pretty quickly for cash in the secondary market. The least liquid assets on this list are consumer loans. These are loans that may not be converted into cash for years. An example is a mortgage.","Liquidity: Liquidity is an important term in financial accounting as well as in banking. It refers to how easily assets can be converted to cash. Individuals, banks, and companies are interested to know which assets are most liquid and can be converted to cash the quickest."
34,Working capital measures the ability of a business to pay off its short-term debt. True or False? Explain in detail.,True,False,,,A,"True
Working capital means the ability of the business to meet their day to day expenses of the enterprise. Working capital is calculated by estimating the variation among the current asset and current liability. The business should be able to pay off the expenses and short term debts in a specific time period. The sufficient working capital in a business shows that the business is able to fund its currents operational activities and to invest in future projects but the higher working capital will not help business growth.","Liquidity: Liquidity means the ability of the asset or security to convert it into cash. The cash is considered as the most liquid form of asset. In business current ratio, quick ratio and cash ratio is used to estimate the liquidity status of the business."
35,"A firm has the production function {eq}q = 0.2LK + 5L^2K - 0.1L^3K

{/eq}. Assume that {eq}K

{/eq} is fixed at 10 in the short run.",What is the short-run production function?,What is the marginal product of labor and the average product of labor in the short run?,"When the firm maximizes its average product of labor, what is the value of {eq}L

{/eq}?",,D,"The production function is: {eq}q = 0.2LK + 5{L^2}K - 0.1{L^3}K{/eq}
If the capital (K) is fixed at 10 units in the short run, then;
A
The short run production keeping K=10 is;
{eq}\begin{align*}

q &= 0.2LK + 5{L^2}K - 0.1{L^3}K\\

q &= 0.2L\left( {10} \right) + 5{L^2}\left( {10} \right) - 0.1{L^3}\left( {10} \right)\\

q &= 2L + 50{L^2} - {L^3}

\end{align*}{/eq}
_B
_
The marginal product of labor is the change in the output (q) if one more unit of labor (L) is employed:
{eq}\begin{align*}

q &= 2L + 50{L^2} - {L^3}\\

MPL &= \dfrac{{\partial q}}{{\partial L}}\\

MPL &= 2 + 100L - 3{L^2}

\end{align*}{/eq}
On the other hand, average product of labor is ratio of the total product of labor to the labor:
{eq}\begin{align*}

q &= 2L + 50{L^2} - {L^3}\\

APL &= \dfrac{q}{L}\\

APL &= \dfrac{{2L + 50{L^2} - {L^3}}}{L}\\

APL &= 2 + 50L - {L^2}

\end{align*}{/eq}
C
Maximizing the average product of labor implies finding its first derivative and putting it equal to zero. Thus;
{eq}\begin{align*}

APL &= 2 + 50L - {L^2}\\

APL' &= 50 - 2L\\

{\rm{putting}}\;APL' &= 0\\

50 - 2L &= 0\\

L* &= 25

\end{align*}{/eq}
25units of labor will be employed in order to maximize average product of labor.",Production function: The producers in the market produce output with the help of various inputs like labor and capital. This same relation between inputs and output when presented in a mathematical form is referred to as the production function of a firm.
36,What of the following is the primary concern of a treasurer managing cash and short-term investments?,Liquidity.,Maximizing return on working capital.,Minimizing taxes.,Minimizing transaction fees.,A,"The correct answer is
a) liquidity.
There must be enough liquidity to meet the payments as due. Liquidity and security are therefore the treasurer's main worries when it comes to highly liquid assets. The willingness to facilitate the regular activities of the business is the purpose of holding the cash and short-term investments.","Liquidity: Liquidity is the measurement of the easiness to convert assets and investments into cash. The highly liquid asserts take little or no time to be converted into cash--for example, fixed deposits, cheques."
37,Which list ranks assets from most to least liquid?,"money, bonds, cars, houses","money, cars, houses, bonds","bonds, money, cars, houses","bonds, cars, money, houses",A,"A. money, bonds, cars, houses
Money is the most liquid asset because it is already in the form of cash and can be easily accessed. Bonds can be converted into cash in a relatively short duration. Cars can be sold for cash quickly but involve paperwork to transfer the title, which takes some additional time. Houses are the least liquid because they are the most valuable and expensive assets and take time to sell. The sale involves finding a buyer, negotiations on the final price, and a considerable amount of paperwork for the transfer of ownership.",Business and Personal Assets: Business or personal assets are items that a business or an individual owns. The liquidity of the assets is measured by how quickly and easily the assets can be sold and converted into cash.
38,The controller's responsibilities include banking relations and cash management.,True,False,,,B,"The statement is FALSE.
Cash management and banking relations would be a part of treasurer's responsibilities.
A controller would be on top of accounting activities.","Cash Management: Cash management refers to collecting payments from customers, making payments to vendors, raising funds for existing operations or new projects, etc. An effective cash management will ensure sufficient working capital and long-term capital for large investments."
39,Concentration banking involves:,using decentralized collection centers,having a large balance at a large commercial bank,having multiple accounts with a brokerage firm,utilizing an investment banker for when trying to market both stocks and bonds,A,"The answer is
a. using decentralized collection centers
The concentration banking is characterized by setting different collection payment centers nationwide. This strategy will reduce the time-consuming of receiving the payments from buyers and waiting time for funds being accessible by the firm.","Collection Payment System: A firm's cash management should ensure that regular operational activities will be running smoothly, which will reduce the potential shortage costs. It will have to establish an efficient collection payment system, which allows the firm to access to its received payments as fast as possible."
40,Which type of account is typically the most liquid?,Checking account,Savings account,Certificate of Deposit,Exchange Traded Fund,A,"(a)	Checking account
Checking accounts is the most liquid as you can withdraw money whenever an account holder wants. There is no limitation on money taken out of the account. So, it is the most liquid near to cash.
The savings account is not the most liquid but it is the best option to store one's money and if one wants to withdraw money from a savings account, they can easily transfer the money from savings to a checking account and then can withdraw the money.
A certificate of deposit is also not liquid as in a certificate of deposit the money is locked up for some fixed period and on that interest is given as one cannot withdraw the money before the maturity period of the certificate of deposit.
The exchange-traded fund is also not liquid as it is a mutual fund that is distributed in units and is traded on the stock exchange and its liquidity depends on certain factors.",Liquidity Liquidity refers to when an asset or security can be converted into cash ready to spend in such a way that the market price is not affected. Cash is considered to be the most liquid asset and other assets can also be converted into cash.
41,Which of the following refers to the opportunity to withdraw money on short notice without incurring a loss in value?,Compounding,Liquidity,Minimum deposit,Rate of return,B,"The answer is B.
Liquidity refers to how fast and easily an asset could be converted to cash or cash equivalent assets. All else the same, a more liquid asset is more desirable because it can be converted for consumption quickly and at no (or low) costs. Thus, one can withdraw money on short notice without incurring losses from liquid assets.","Bond Risks: The price of a bond is affected by various bond-specific factors such as coupon rate, par value, and term to maturity. The bond price is also affected by other market factors such as the expected inflation rate."
42,"If there is no difference in risk, then we expect that as assets become more liquid, the return on those assets will:",Increase,Decrease,Remain the same,,B,"The answer is b).
Liquidity is a desirable characteristic of assets. Thus, all else the same, the more liquid an asset is, the more desirable it is. When assets become more liquid, the demand for the asset increase, and so will the price. Since price and return are negatively correlated, the higher the price, the lower the return.","Asset Return: The return on an asset is determined by a range of factors including the riskiness of the asset, the risk free rate and the liquidity of the asset. The higher the risk, the higher the required return."
43,_____ relationship exists between a firm's liquid asset balance and shortage costs.,A unified,A positively correlated,An inverse,A linear,C,"The answer is
c. An inverse
If a firm can maintain sufficient funds for its operation, it will not need to pay for fees on emergency loans and other transaction costs. Thus, the firm's liquid asset balance will have an inverse relationship with the shortage costs.","Liquidity: In a business, liquidity management is necessary since it will avoid operational activities to be shut down by the lack of funds. Depending on business size, the liquidity management will be organized differently."
44,"In the liquidity preference framework, a one-time increase in the money supply results in a price level effect. The maximum impact of the price level effect on interest rates occurs:",at the moment the price level hits its peak (stops rising) because both the price level and expected inflation effects are at work.,"immediately after the price level begins to rise, because both the price level and expected inflation effects are at work.",at the moment the expected inflation rate hits its peak.,at the moment the inflation rate hits it peak.,A,"The correct answer is
Option A
When the supply of money in the market increases or decreases, it affects the price level effect, i.e., interest rate. The price level effect stops rising when inflation peaks because the supply of money in the market decreases and the price level reaches its highest point.
The explanation of incorrect options are:
B) immediately after the price level begins to rise, because both the price level and expected inflation effects are at work:
The impact of an increase in the price level decreases the economy's purchasing power. The lending and borrowing activities reduce, and the price level effect does not reach its peak.
C) at the moment the expected inflation rate hits its peak:
A limitation to the rise of the predicted inflation will not affect the price level effect. When the actual rate of inflation hits its peak, the price level will be affected maximum.
D) at the moment the inflation rate hits its peak:
To impact the price level effect, the inflation shall hit its peak, and the liquidity effect shall be maximum.",Law of Demand and Supply: The law of demand and supply establishes the relationship between the suppliers and buyers of the goods and services to determine the commodity's price. The law of demand and supply works at a given level of the number of goods or services.
45,"During the most recent month, Campbell Company began operations with a cash balance of {eq}\$0

{/eq} and made cash sales of {eq}\$162,000

{/eq}. During this same time period, the company paid {eq}\$64,000

{/eq} in cash expenses. Additionally, the company purchased supplies on account {eq}\$68,000

{/eq}, made sales on account, {eq}\$180,000

{/eq}, and paid cash on account {eq}\$12,000

{/eq}.","If cash at the end of the month totals {eq}\$148,000

{/eq}, how much cash was received on an account?",What is the total amount still to be paid?,What is the total amount still to be received?,,A,"PART - A)
{eq}\begin{align*}{\rm\text{Cash}}\,{\rm\text{received}}\,{\rm\text{on}}\,{\rm\text{account}}&= {\rm\text{Closing}}\,{\rm\text{balance}} - {\rm\text{Opening}}\,{\rm\text{balance}} -{\rm\text{Cash}}\,{\rm\text{sales}} + \,{\rm\text{Cash}}\,{\rm\text{expenses}} +{\rm\text{Cash}}\,{\rm\text{paid}}\,{\rm\text{on}}\,{\rm\text{account}}\\&= \$ \,148,000 - \$ \,0 - \$ \,162,000 + \$ \,64,000 + \$ \,12,000\\&= \$ \,62,000\end{align*}\

{/eq}
PART - B)
{eq}\begin{align*}{\rm\text{Amount}}\,{\rm\text{still}}\,{\rm\text{to}}\,{\rm\text{be}}\,{\rm\text{paid}}&= {\rm\text{Supplies}}\,{\rm\text{on}}\,{\rm\text{account}} -{\rm\text{Cash}}\,{\rm\text{paid}}\,{\rm\text{on}}\,{\rm\text{account}}\\&= \$ \,68,000 - \$ \,12,000\\&= \$ \,50,000\end{align*}\

{/eq}
PART - C)
{eq}\begin{align*}{\rm\text{Total}}\,{\rm\text{amount}}\,{\rm\text{still}}\,{\rm\text{to}}\,{\rm\text{be}}\,{\rm\text{received}}&={\rm\text{Sales}}\,{\rm\text{on}}\,{\rm\text{account}} - {\rm\text{Cash}}\,{\rm\text{received}}\,{\rm\text{on}}\,{\rm\text{account}}\\&= \$ \,180,000 - \$ \,62,000\\&= \$ \,118,000\end{align*}\

{/eq}","Cash Management: Depreciation refers to the way of reducing the used value of the asset. It is a non-cash item recorded on the debit side of the income statement and transferred to the account of accumulated depreciation. It reduced the value of plant, property, and equipment except for land."
46,The liquidity trap occurs when _____.,there is a large reduction in the demand for loanable funds.,the nominal interest rate falls to zero.,monetary policy becomes ineffective.,All of the above are correct.,D,"Option d, All of the above are correct
is the correct option.
Option a: In a liquidity trap, all consumers prefer holding cash rather than investing it in bonds or anything else, and they expect a surge in interest rates. Hence, option a is a true statement.
Option b: During liquidity traps, interest rates are very low and sometimes close to zero. Hence, option b is correct.
Option c: Monetary policy becomes ineffective as, although central banks inject liquidity, there is a high belief in negative economic events, which makes it ineffective. Consumers prefer cash and liquidate their holdings, driving the prices further down. Hence, option c is a true statement.",Monetary Policy: Monetary policy is influenced by the central bank. The main reason for using monetary policy is to control inflation. This requires the central bank to both pour liquidity into and suck liquidity from the markets as per the situation.
47,"The ""shortage"" costs associated with inadequate liquid asset balances include all of the following except:",deterioration of the firm's credit rating,foregone cash discounts,lost sales,possible financial insolvency,A,"The answer is
a. Deterioration of the firm's credit rating.
The shortage of liquidity might cause immediate impacts  on the firm's operation such as following concerns:
A firm will not be able to process a payment within the given discount period.
A firm will not have sufficient money for purchasing production inputs, which will not be able to meet the market demand.
If debt repayments arise at the same time,  the operation will incur a serious issue of financial insolvency.
In practice, the shortage of funds will not affect the firm's credit raking immediately.","Liquidity: Liquidity management is one of the most important practice to firm's managers, which aims to sustain business for an efficiency operation. Usually, a firm would hold a proposition of total assets in forms of short-term assets to protect firm's liquidity."
49,Cash management involves the determination of:,the best locations for lockboxes,setting up decentralized collection centers,both a and b,neither a nor b,C,"The answer is
c. Both a and b
Cash management will also aim to expedite the collection period, which increases the cash inflows for the business at the moment. In practice, selecting the location of lockboxes or setting up decentralized collection centers will help to reduce the time-consuming of payment processing. Alternatively, firm will access to its payments quickly.","Cash Management: An efficient cash management supports a firm to sustain its liquidity. By properly scheduling cash receipts and cash disbursements, managers can reduce the potential risk of being lack of money in the operation. With that being said, regular activities could be sustained effectively."
50,Explain the relationship between liquidity management from the financial day to day operation of :,educational institution,hospital,short-term projects of an organization,,A,"a. Liquidity management is required in educational institutions daily. It can be daily expenses like maintenance of the facilities like library, sanitation, water facilities, transportation facilities.
b. Liquidity management is required in hospitals daily. It can be daily expenses like arranging the blood groups from outside, maintain the quality of services, cleaning services requirements.
c. Liquidity management is required in short-term projects of an organization daily. It can be daily expenses like purchasing raw material, maintain the working environment by providing drinking water, sanitation facilities.",Liquidity management Liquidity management depicts converting the asset into cash at less time period. The cash helps different facilities and services to run smoothly.
