id,question,A,B,C,D,Answer,Explanation,Hint
51,True or False: The fact that corporations' shares are easily traded within the market has a net effect of acting as a disincentive for managers to favor the interests of shareholders over their own interests.,True,False,,,B,"The answer is false.  The managers of publicly traded companies are very concerned with the market price of the shares of their company.  Moreover, given the liquidity of their shares, they are very concerned with the interests of shareholders.  If shareholders were to collectively sell, it would cause a sudden technical imbalance (with sales orders far exceeding buy-side demand), resulting in a plummeting stock price.  Ultimately, this would adversely affect the managers' compensation and job security.","Liquidity: In the context of the stock market, liquidity is the extent to which a stock can quickly trade without experiencing a significant change in price.  Generally, as the number of market participants increases and information becomes more accessible, liquidity increases."
52,"Generally, the first concern of a financial analyst is a firm's liquidity. True or false?",True,False,,,A,"*The statement is True.
The first concern of a financial analyst s a firm's liquidity. Further, a firm's liquidity is all about the capacity to raise funds when required. If the firm's liquidity is good, then the firm can survive in long term. Additionally, financial analysts check the firm's liquidity to check the capacity of a company. So the statement is true.","Financial Analyst: A corporate does a financial analysis of the firm for prospects. Further, financial analysts check all the aspects of a business for risk mitigation and future planning."
53,"If households convert some of their bank deposits into currency, then, other things equal:",commercial banks' reserves decline and the monetary base is unchanged.,commercial banks' reserves decline and the monetary base declines.,commercial banks' reserves rise and the monetary base rises.,commercial banks' reserves are unchanged and the monetary base is unchanged.,A,"The correct option is A) commercial banks' reserves decline and the monetary base is unchanged.
If the households, convert their bank deposits into currency, then commercial bank's reserves decline as there has been an outflow of money from the banks and now they have less reserves to lend out. Whereas, the monetary base refers to the entire amount of currency being circulated in the economy i.e., either through bank deposits and loans or through in hand currency transactions. So, the monetary base remains unchanged.
Reasons for incorrect options:
Option B) is incorrect because conversion from bank deposits to currency doesn't lead to fall in the monetary base.
Option C) is incorrect because conversion from bank deposits to currency doesn't lead to rise in commercial bank reserves.
Option D) is incorrect because conversion from bank deposits to currency leads to a change in commercial bank reserves.",Liquidity Liquidity is a very important concept which deals with the amount of money circulating in an economy in a given period. It determines the amount of money supply required to be done through various monetary policy tools. It also indicates the amount of economic activity taking place in the economy as higher liquidity can lead to a higher number of transactions and production but it can also lead to inflation and ultimately liquidity trap.
54,Which of the following investments is the most liquid?,Certificate of deposit,Corporate bond,Interest-bearing checking account,Municipal bond,C,"As outlined below, the fact set and answer choices can be interpreted in two ways.
If the question is using the word ""investments"" synonymous with ""assets,"" then the best answer choice is C. Interest-bearing checking account.  Cash is the most liquid asset listed and is an excellent store of value over the near- to medium-term.
If the question is using the word ""investments"" in a strict fashion, then I would not consider a checking-account to be an investment.  It is a transactional account used to facilitate near-term disbursements.  In this case, the best possible answer choice is B. Corporate bond.  Additional detail is outlined below.
-	A is suboptimal because certificates of deposit have a lock-up period that can't be violated without penalty.
-	D. is suboptimal, because municipal bonds are generally considered to be less liquid than corporates.
-	E. is suboptimal, because depending on the specific company, preferred stocks can trade very infrequently.","Liquid Asset: A liquid asset is one that can be bought or sold quickly without experiencing a significant change in price.  Safe-haven assets, such as U.S. Treasury securities, tend to exhibit a high degree of liquidity."
